{
    "$schema": "http://json-schema.org/draft-07/schema#",
    "$id": "https://github.com/openstreetmap/id-tagging-schema/raw/main/schemas/preset_defaults.json",
    "title": "Default presets",
    "description": "Directory of the IDs of the presets or categories to be shown in the default list for each geometry type.",
    "type": "object",
    "properties": {
        "point": {
            "type": "array",
            "minItems": 1,
            "uniqueItems": true,
            "items": {
                "type": "string"
            }
        },
        "vertex": {
            "type": "array",
            "minItems": 1,
            "uniqueItems": true,
            "items": {
                "type": "string"
            }
        },
        "line": {
            "type": "array",
            "minItems": 1,
            "uniqueItems": true,
            "items": {
                "type": "string"
            }
        },
        "area": {
            "type": "array",
            "minItems": 1,
            "uniqueItems": true,
            "items": {
                "type": "string"
            }
        },
        "relation": {
            "type": "array",
            "minItems": 1,
            "uniqueItems": true,
            "items": {
                "type": "string"
            }
        }
    },
    "required": [
        "point",
        "vertex",
        "line",
        "area",
        "relation"
    ],
    "additionalProperties": false
}
