{
    "area": [
        "category-landuse",
        "category-building",
        "category-water",
        "category-natural",
        "leisure/park",
        "amenity/hospital",
        "amenity/place_of_worship",
        "amenity/cafe",
        "amenity/restaurant",
        "area"
    ],
    "line": [
        "category-road_major",
        "category-road_minor",
        "category-rail",
        "category-path",
        "category-waterway",
        "category-barrier",
        "category-natural",
        "category-utility",
        "line"
    ],
    "point": [
        "category-natural",
        "leisure/park",
        "amenity/hospital",
        "amenity/place_of_worship",
        "amenity/cafe",
        "amenity/restaurant",
        "amenity/fast_food",
        "amenity/bar",
        "amenity/bank",
        "shop/supermarket",
        "category-advertising",
        "point"
    ],
    "vertex": [
        "highway/crossing/traffic_signals",
        "highway/crossing/uncontrolled",
        "highway/crossing/unmarked",
        "railway/level_crossing",
        "highway/traffic_signals",
        "highway/turning_circle",
        "highway/turning_loop",
        "traffic_calming",
        "highway/mini_roundabout",
        "highway/motorway_junction",
        "point"
    ],
    "relation": [
        "category-route",
        "category-restriction",
        "public_transport/stop_area",
        "type/boundary",
        "type/waterway",
        "type/multipolygon",
        "type/enforcement",
        "type/site",
        "relation"
    ]
}